<?xml version="1.0" encoding="UTF-8"?>
<!DOCTYPE configuration SYSTEM "configuration.dtd">
<configuration>

<!-- check attributes: vendor_id acc_appl_id role metric , MT sep. 15 2004 -->

   <general>
      <product>Open Diameter</product>
      <version>1</version>
      <vendor_id>0</vendor_id>
      <supported_vendor_id>0</supported_vendor_id>
      <supported_vendor_id>1</supported_vendor_id>
      <auth_application_id>1</auth_application_id>
      <auth_application_id>2</auth_application_id>
      <acct_application_id>3</acct_application_id>
      <acct_application_id>4</acct_application_id>
      <vendor_specific_application_id>
          <vendor_id>31</vendor_id>
          <auth_application_id>2</auth_application_id>
      </vendor_specific_application_id>
      <vendor_specific_application_id>
          <vendor_id>41</vendor_id>
          <acct_application_id>6</acct_application_id>
      </vendor_specific_application_id>
   </general>
   <parser> 
      <dictionary>config/dictionary.xml</dictionary>
   </parser>
   <transport_mngt>
      <identity>hac.homedomain.com</identity>
      <realm>homedomain.com</realm>
      <tcp_listen_port>1800</tcp_listen_port>
      <sctp_listen_port>1801</sctp_listen_port>
      <use_ipv6>0</use_ipv6>
      <watchdog_timeout>3</watchdog_timeout>
      <reconnect_interval>30</reconnect_interval>
      <reconnect_max>3</reconnect_max>
      <request_retransmission_interval>10</request_retransmission_interval>
      <max_request_retransmission_count>3</max_request_retransmission_count>
      <advertised_hostname>hac01.homedomain.com</advertised_hostname>
      <advertised_hostname>hac02.homedomain.com</advertised_hostname>
      <peer_table>
          <expiration_time>1</expiration_time>
          <peer>
              <hostname>aaaserver.homedomain.com</hostname>
              <port>1802</port>
              <use_sctp>0</use_sctp>
              <tls_enabled>0</tls_enabled>
          </peer>
      </peer_table>
      <route_table>
          <expire_time>360</expire_time>
          <route>
             <realm>homedomain.com</realm>
             <role>1</role>
             <redirect_usage>0</redirect_usage>
             <application>
                <application_id>3</application_id>
                <vendor_id>0</vendor_id>
                <peer_entry>
                    <server>aaaserver.homedomain.com</server>
                    <metric>2</metric>
                </peer_entry>
             </application> 
             <application>
                <application_id>2</application_id>
                <vendor_id>0</vendor_id>
                <peer_entry>
                    <server>aaaserver.homedomain.com</server>
                    <metric>2</metric>
                </peer_entry>
             </application>
          </route>
     </route_table>
   </transport_mngt>
   <session_mngt>
      <max_sessions>10000</max_sessions>
      <auth_sessions>
         <stateful>1</stateful>
         <session_timeout>361</session_timeout>
         <lifetime_timeout>360</lifetime_timeout>
         <grace_period_timeout>30</grace_period_timeout>
         <abort_retry_timeout>20</abort_retry_timeout>
      </auth_sessions>
      <acct_sessions>
         <session_timeout>30</session_timeout>
         <interim_interval>5</interim_interval>
         <realtime>1</realtime>
      </acct_sessions>
   </session_mngt>
   <log>
      <flags>
         <debug>enabled</debug>
         <trace>enabled</trace>
         <info>enabled</info>
      </flags>
      <target>
         <console>enabled</console>
         <syslog>disabled</syslog>
      </target>
   </log>
</configuration>
