<?xml version="1.0" encoding="UTF-8"?>
<!DOCTYPE configuration SYSTEM "configuration.dtd">
<configuration>
   <general>
      <product>Open Diameter</product>
      <version>1</version>
      <vendor_id>0</vendor_id>
      <supported_vendor_id>0</supported_vendor_id>
      <supported_vendor_id>1</supported_vendor_id>
      <auth_application_id>1</auth_application_id>
      <auth_application_id>2</auth_application_id>
      <acct_application_id>3</acct_application_id>
      <acct_application_id>4</acct_application_id>
      <vendor_specific_application_id>
          <vendor_id>31</vendor_id>
          <auth_application_id>2</auth_application_id>
      </vendor_specific_application_id>
      <vendor_specific_application_id>
          <vendor_id>41</vendor_id>
          <acct_application_id>6</acct_application_id>
      </vendor_specific_application_id>
   </general>
   <parser> 
      <dictionary>config/dictionary.xml</dictionary>
   </parser>
   <transport_mngt>
      <identity>aaaserver.telcordias.com</identity>
      <realm>telcordias.com</realm>
      <tcp_listen_port>1802</tcp_listen_port>
      <sctp_listen_port>1803</sctp_listen_port>
      <use_ipv6>0</use_ipv6>
      <watchdog_timeout>4</watchdog_timeout>
      <reconnect_interval>30</reconnect_interval>
      <reconnect_max>3</reconnect_max>
      <request_retransmission_interval>10</request_retransmission_interval>
      <max_request_retransmission_count>3</max_request_retransmission_count>
      <advertised_hostname>aaaserver01.telcordias.com</advertised_hostname>
      <advertised_hostname>aaaserver02.telcordias.com</advertised_hostname>
      <peer_table>
          <expiration_time>1</expiration_time>
          <peer>
              <hostname>mhc.telcordia.com</hostname>
              <port>1801</port>
              <use_sctp>0</use_sctp>
              <tls_enabled>0</tls_enabled>
          </peer>
      </peer_table>
      <route_table>
          <expire_time>0</expire_time>
          <route>
             <realm>telcordia.com</realm>
             <role>0</role> 
             <redirect_usage>0</redirect_usage>
             <application>
                <application_id>3</application_id>
                <vendor_id>0</vendor_id>
                <peer_entry>
                    <server>mhc.telcordia.com</server>
                    <metric>2</metric>
                </peer_entry>
                <peer_entry>
                    <server>nas2.research1.org</server>
                    <metric>4</metric>
                </peer_entry>
                <peer_entry>
                    <server>nas3.research1.org</server>
                    <metric>5</metric>
                </peer_entry>
             </application>
             <application>
                <application_id>1</application_id>
                <vendor_id>0</vendor_id>
                <peer_entry>
                    <server>mhc.telcordia.com</server>
                    <metric>2</metric>
                </peer_entry>
                <peer_entry>
                    <server>nas2.research1.org</server>
                    <metric>4</metric>
                </peer_entry>
                <peer_entry>
                    <server>nas3.research1.org</server>
                    <metric>5</metric>
                </peer_entry>
             </application>
          </route>
          <default_route>
             <realm>telcordia.com</realm>
             <role>0</role> 
             <redirect_usage>0</redirect_usage>
             <application>
                <application_id>3</application_id>
                <vendor_id>0</vendor_id>
                <peer_entry>
                    <server>mhc.telcordia.com</server>
                    <metric>4</metric>
                </peer_entry>
                <peer_entry>
                    <server>nas3.research1.org</server>
                    <metric>5</metric>
                </peer_entry>
             </application>
          </default_route>
      </route_table>
   </transport_mngt>
   <session_mngt>
      <max_sessions>10000</max_sessions>
      <stateful>1</stateful>
      <timers>
         <session>30</session>
         <lifetime>360</lifetime>
         <grace>30</grace>
         <abort_retry>20</abort_retry>
      </timers>
   </session_mngt>
   <log>
      <flags>
         <debug>enabled</debug>
         <trace>enabled</trace>
         <info>enabled</info>
      </flags>
      <target>
         <console>enabled</console>
         <syslog>enabled</syslog>
      </target>
   </log>
</configuration>
